{
  "id": "external-plugin:agent-sdk-dev@claude-plugins-official",
  "name": "agent-sdk-dev@claude-plugins-official",
  "type": "external-plugin",
  "path": "vendor/upstream/claude-plugins-official/plugins/agent-sdk-dev",
  "origin": {
    "kind": "upstream",
    "source": "claude-plugins-official/plugins/agent-sdk-dev",
    "sha": "fa59bc9037741ecfa131aa27938272605710d7b2",
    "license": "Apache-2.0"
  },
  "responsibility": "Kit oficial para aplicações com Claude Agent SDK (/new-sdk-app, verificadores py/ts) — reservado para a F2 (Vera Agente) se ela virar aplicação independente.",
  "dependencies": [
    "upstream-reference:claude-plugins-official"
  ],
  "tools": [],
  "related": {
    "skills": [],
    "agents": [],
    "commands": []
  },
  "status": "reference",
  "version": "upstream@fa59bc90",
  "integration": {
    "date": "2026-09-28",
    "reason": "Modo C (Agent SDK) fora do escopo agora; referência para F2.",
    "ingestion": "ING-0001"
  },
  "tests": []
}
