{
  "id": "mcp-tool:estado.evidence_add",
  "name": "estado.evidence_add",
  "type": "mcp-tool",
  "path": "src/mcp/estado.ts",
  "parent": "mcp-server:estado",
  "origin": {
    "kind": "proprietary",
    "source": "servidor estado"
  },
  "responsibility": "Registrar evidência (escrita no workspace, reversível via git).",
  "dependencies": [],
  "tools": [
    "mcp__plugin_maestro_estado__evidence_add"
  ],
  "related": {
    "skills": [],
    "agents": [],
    "commands": []
  },
  "status": "active",
  "version": "0.1.0",
  "integration": {
    "date": "2026-09-28",
    "reason": "Ferramenta do servidor estado.",
    "ingestion": "ING-0002"
  },
  "tests": [
    "tests/integration/mcp-estado.test.ts"
  ]
}
